{
  "protocolVersion": "0.1",
  "eventId": "evt_005",
  "runId": "run_demo_001",
  "taskId": "task_demo_001",
  "timestamp": "2026-04-28T14:00:04Z",
  "type": "artifact.created",
  "level": "info",
  "message": "Patch artifact created",
  "data": {
    "artifactType": "patch",
    "uri": "file://.anchorage/runs/run_demo_001/change.patch",
    "mediaType": "text/x-diff",
    "sizeBytes": 512
  }
}
